{
  "$schema": "https://json-schema.org/draft/2020-12/schema",
  "title": "NHMS Node-27 Timeseries Compression Runner Receipt",
  "type": "object",
  "additionalProperties": false,
  "required": [
    "schema_version",
    "generated_at",
    "mode",
    "outcome"
  ],
  "properties": {
    "schema_version": {"enum": ["1.0", "2.0", "2.1", "2.2"]},
    "head_sha": {"type": "string", "pattern": "^[0-9a-f]{40}$"},
    "mutation_head_sha": {"type": "string", "pattern": "^[0-9a-f]{40}$"},
    "provenance_state": {"enum": ["bound", "unavailable"]},
    "generated_at": {"type": "string", "format": "date-time"},
    "now_utc": {"type": "string", "format": "date-time"},
    "lag_seconds": {"type": "integer", "minimum": 1},
    "per_tick_bound": {"type": "integer", "minimum": 1},
    "budget": {"$ref": "#/$defs/budget"},
    "mode": {"enum": ["dry-run", "enforce"]},
    "outcome": {"enum": ["clean", "partial", "deferred", "refused_lock", "refused_config", "failed"]},
    "deferred_contended_count": {"type": "integer", "minimum": 0},
    "selected": {
      "type": "array",
      "maxItems": 100000,
      "items": {"$ref": "#/$defs/selected_descriptor"}
    },
    "deferred": {
      "type": "array",
      "maxItems": 100000,
      "items": {"$ref": "#/$defs/deferred_descriptor"}
    },
    "skipped": {
      "type": "array",
      "maxItems": 100000,
      "items": {"$ref": "#/$defs/skipped_descriptor"}
    },
    "per_table_totals": {
      "type": "object",
      "additionalProperties": false,
      "required": ["hydro.river_timeseries", "met.forcing_station_timeseries"],
      "patternProperties": {
        "^(hydro\\.river_timeseries_legacy|met\\.forcing_station_timeseries_legacy)$": {"$ref": "#/$defs/table_total"}
      },
      "properties": {
        "hydro.river_timeseries": {"$ref": "#/$defs/table_total"},
        "met.forcing_station_timeseries": {"$ref": "#/$defs/table_total"}
      }
    },
    "failure": {
      "type": "object",
      "additionalProperties": false,
      "required": ["stage", "mutation_state"],
      "properties": {
        "stage": {"type": "string", "minLength": 1},
        "mutation_state": {"enum": ["failed_before_mutation", "indeterminate"]}
      }
    }
  },
  "allOf": [
    {
      "if": {"properties": {"outcome": {"const": "refused_lock"}}, "required": ["outcome"]},
      "then": {
        "properties": {
          "selected": {"maxItems": 0},
          "deferred": {"maxItems": 0},
          "skipped": {"maxItems": 0},
          "per_table_totals": {
            "properties": {
              "hydro.river_timeseries": {"$ref": "#/$defs/refused_table_total"},
              "met.forcing_station_timeseries": {"$ref": "#/$defs/refused_table_total"}
            }
          }
        }
      }
    },
    {
      "if": {
        "properties": {"schema_version": {"const": "1.0"}},
        "required": ["schema_version"]
      },
      "then": {
        "properties": {
          "outcome": {"enum": ["clean", "partial", "refused_lock", "refused_config"]}
        },
        "allOf": [
          {"not": {"required": ["head_sha"]}},
          {"not": {"required": ["failure"]}},
          {"not": {"required": ["provenance_state"]}},
          {"not": {"required": ["budget"]}}
        ]
      }
    },
    {
      "if": {
        "properties": {"schema_version": {"const": "2.0"}},
        "required": ["schema_version"]
      },
      "then": {"not": {"required": ["budget"]}}
    },
    {
      "if": {
        "properties": {"schema_version": {"enum": ["2.1", "2.2"]}},
        "required": ["schema_version"]
      },
      "then": {
        "if": {
          "allOf": [
            {"properties": {"outcome": {"const": "failed"}}, "required": ["outcome"]},
            {
              "properties": {
                "failure": {
                  "properties": {"stage": {"const": "config"}},
                  "required": ["stage"]
                }
              },
              "required": ["failure"]
            },
            {"not": {"required": ["per_tick_bound"]}}
          ]
        },
        "then": {"not": {"required": ["budget"]}},
        "else": {"required": ["budget"]}
      }
    },
    {
      "if": {
        "properties": {"schema_version": {"enum": ["1.0", "2.0", "2.1"]}},
        "required": ["schema_version"]
      },
      "then": {
        "properties": {
          "outcome": {"not": {"const": "deferred"}},
          "budget": {"not": {"required": ["fence_wait_ms"]}},
          "selected": {
            "items": {
              "not": {
                "anyOf": [
                  {"required": ["fence_wait_elapsed_ms"]},
                  {"properties": {"mutation_state": {"const": "deferred_contended"}}, "required": ["mutation_state"]}
                ]
              }
            }
          }
        },
        "not": {"required": ["deferred_contended_count"]}
      }
    },
    {
      "if": {
        "properties": {"schema_version": {"const": "2.2"}},
        "required": ["schema_version"]
      },
      "then": {
        "properties": {"budget": {"required": ["fence_wait_ms"]}},
        "if": {"properties": {"outcome": {"const": "failed"}}, "required": ["outcome"]},
        "then": {"not": {"required": ["deferred_contended_count"]}},
        "else": {"required": ["deferred_contended_count"]}
      }
    },
    {
      "if": {
        "properties": {"outcome": {"const": "deferred"}},
        "required": ["outcome"]
      },
      "then": {
        "properties": {
          "mode": {"const": "enforce"},
          "deferred_contended_count": {"minimum": 1}
        }
      }
    },
    {
      "if": {
        "properties": {
          "schema_version": {"enum": ["2.0", "2.1", "2.2"]},
          "outcome": {"enum": ["clean", "partial", "deferred", "refused_lock", "refused_config"]}
        },
        "required": ["schema_version", "outcome"]
      },
      "then": {"required": ["head_sha"]}
    },
    {
      "if": {"properties": {"outcome": {"const": "failed"}}, "required": ["outcome"]},
      "then": {
        "required": ["failure", "provenance_state"],
        "properties": {"schema_version": {"enum": ["2.0", "2.1", "2.2"]}},
        "allOf": [
          {
            "if": {
              "properties": {"provenance_state": {"const": "bound"}},
              "required": ["provenance_state"]
            },
            "then": {"required": ["head_sha", "mutation_head_sha"]},
            "else": {"not": {"anyOf": [{"required": ["head_sha"]}, {"required": ["mutation_head_sha"]}]}}
          }
        ]
      },
      "else": {
        "not": {"anyOf": [{"required": ["failure"]}, {"required": ["provenance_state"]}]},
        "required": [
          "now_utc", "lag_seconds", "per_tick_bound", "selected", "deferred",
          "skipped", "per_table_totals"
        ]
      }
    }
  ],
  "$defs": {
    "budget": {
      "type": "object",
      "additionalProperties": false,
      "required": ["compress_timeout_ms", "wrapper_wall_seconds", "systemd_wall_seconds"],
      "properties": {
        "compress_timeout_ms": {"type": "integer", "minimum": 1000},
        "wrapper_wall_seconds": {"type": "integer", "minimum": 1},
        "systemd_wall_seconds": {"type": "integer", "minimum": 1},
        "cleanup_margin_seconds": {"type": "integer", "minimum": 1},
        "fence_wait_ms": {"type": "integer", "minimum": 1}
      }
    },
    "selected_descriptor": {
      "type": "object",
      "additionalProperties": false,
      "required": [
        "hypertable_schema",
        "hypertable_name",
        "chunk_schema",
        "chunk_name",
        "range_start",
        "range_end",
        "before_bytes",
        "after_bytes"
      ],
      "properties": {
        "hypertable_schema": {"type": "string", "minLength": 1},
        "hypertable_name": {"type": "string", "minLength": 1},
        "chunk_schema": {"type": "string", "minLength": 1},
        "chunk_name": {"type": "string", "minLength": 1},
        "range_start": {"type": "string", "format": "date-time"},
        "range_end": {"type": "string", "format": "date-time"},
        "before_bytes": {"type": "integer", "minimum": 0},
        "after_bytes": {"type": ["integer", "null"], "minimum": 0},
        "error": {"type": "string", "minLength": 1},
        "mutation_state": {
          "enum": ["not_applicable", "failed_before_mutation", "committed", "indeterminate", "deferred_contended"]
        },
        "fence_wait_elapsed_ms": {"type": "integer", "minimum": 0}
      }
    },
    "deferred_descriptor": {
      "type": "object",
      "additionalProperties": false,
      "required": [
        "hypertable_schema",
        "hypertable_name",
        "chunk_schema",
        "chunk_name",
        "range_start",
        "range_end",
        "before_bytes",
        "after_bytes",
        "defer_reason"
      ],
      "properties": {
        "hypertable_schema": {"type": "string", "minLength": 1},
        "hypertable_name": {"type": "string", "minLength": 1},
        "chunk_schema": {"type": "string", "minLength": 1},
        "chunk_name": {"type": "string", "minLength": 1},
        "range_start": {"type": "string", "format": "date-time"},
        "range_end": {"type": "string", "format": "date-time"},
        "before_bytes": {"type": "integer", "minimum": 0},
        "after_bytes": {"type": ["integer", "null"], "minimum": 0},
        "defer_reason": {"type": "string", "minLength": 1}
      }
    },
    "skipped_descriptor": {
      "type": "object",
      "additionalProperties": false,
      "required": [
        "hypertable_schema",
        "hypertable_name",
        "chunk_schema",
        "chunk_name",
        "range_start",
        "range_end",
        "before_bytes",
        "after_bytes",
        "skip_reason"
      ],
      "properties": {
        "hypertable_schema": {"type": "string", "minLength": 1},
        "hypertable_name": {"type": "string", "minLength": 1},
        "chunk_schema": {"type": "string", "minLength": 1},
        "chunk_name": {"type": "string", "minLength": 1},
        "range_start": {"type": "string", "format": "date-time"},
        "range_end": {"type": "string", "format": "date-time"},
        "before_bytes": {"type": "integer", "minimum": 0},
        "after_bytes": {"type": ["integer", "null"], "minimum": 0},
        "skip_reason": {"type": "string", "minLength": 1}
      }
    },
    "table_total": {
      "type": "object",
      "additionalProperties": false,
      "required": ["before_bytes", "after_bytes", "chunks_compressed"],
      "properties": {
        "before_bytes": {"type": "integer", "minimum": 0},
        "after_bytes": {"type": ["integer", "null"], "minimum": 0},
        "chunks_compressed": {"type": "integer", "minimum": 0}
      }
    },
    "refused_table_total": {
      "type": "object",
      "additionalProperties": false,
      "required": ["before_bytes", "after_bytes", "chunks_compressed"],
      "properties": {
        "before_bytes": {"const": 0},
        "after_bytes": {"type": "null"},
        "chunks_compressed": {"const": 0}
      }
    }
  }
}
