{"deferred":[{"after_bytes":null,"before_bytes":0,"chunk_name":"_hyper_3_8_chunk","chunk_schema":"_timescaledb_internal","defer_reason":"per-tick bound reached","hypertable_name":"river_timeseries","hypertable_schema":"hydro","range_end":"2026-06-11T00:00:00Z","range_start":"2026-06-04T00:00:00Z"},{"after_bytes":null,"before_bytes":0,"chunk_name":"_hyper_3_1_chunk","chunk_schema":"_timescaledb_internal","defer_reason":"per-tick bound reached","hypertable_name":"river_timeseries","hypertable_schema":"hydro","range_end":"2026-06-18T00:00:00Z","range_start":"2026-06-11T00:00:00Z"},{"after_bytes":null,"before_bytes":0,"chunk_name":"_hyper_3_2_chunk","chunk_schema":"_timescaledb_internal","defer_reason":"per-tick bound reached","hypertable_name":"river_timeseries","hypertable_schema":"hydro","range_end":"2026-06-25T00:00:00Z","range_start":"2026-06-18T00:00:00Z"},{"after_bytes":null,"before_bytes":0,"chunk_name":"_hyper_3_9_chunk","chunk_schema":"_timescaledb_internal","defer_reason":"per-tick bound reached","hypertable_name":"river_timeseries","hypertable_schema":"hydro","range_end":"2026-07-02T00:00:00Z","range_start":"2026-06-25T00:00:00Z"},{"after_bytes":null,"before_bytes":0,"chunk_name":"_hyper_1_5_chunk","chunk_schema":"_timescaledb_internal","defer_reason":"per-tick bound reached","hypertable_name":"forcing_station_timeseries","hypertable_schema":"met","range_end":"2026-06-04T00:00:00Z","range_start":"2026-05-28T00:00:00Z"},{"after_bytes":null,"before_bytes":0,"chunk_name":"_hyper_1_6_chunk","chunk_schema":"_timescaledb_internal","defer_reason":"per-tick bound reached","hypertable_name":"forcing_station_timeseries","hypertable_schema":"met","range_end":"2026-06-11T00:00:00Z","range_start":"2026-06-04T00:00:00Z"},{"after_bytes":null,"before_bytes":0,"chunk_name":"_hyper_1_3_chunk","chunk_schema":"_timescaledb_internal","defer_reason":"per-tick bound reached","hypertable_name":"forcing_station_timeseries","hypertable_schema":"met","range_end":"2026-06-18T00:00:00Z","range_start":"2026-06-11T00:00:00Z"},{"after_bytes":null,"before_bytes":0,"chunk_name":"_hyper_1_4_chunk","chunk_schema":"_timescaledb_internal","defer_reason":"per-tick bound reached","hypertable_name":"forcing_station_timeseries","hypertable_schema":"met","range_end":"2026-06-25T00:00:00Z","range_start":"2026-06-18T00:00:00Z"},{"after_bytes":null,"before_bytes":0,"chunk_name":"_hyper_1_11_chunk","chunk_schema":"_timescaledb_internal","defer_reason":"per-tick bound reached","hypertable_name":"forcing_station_timeseries","hypertable_schema":"met","range_end":"2026-07-02T00:00:00Z","range_start":"2026-06-25T00:00:00Z"}],"generated_at":"2026-07-15T11:44:20.663763Z","head_sha":"8e77db55e47034c426147b4627b7af2099145389","lag_seconds":604800,"mode":"enforce","now_utc":"2026-07-15T11:44:10.303183Z","outcome":"clean","per_table_totals":{"hydro.river_timeseries":{"after_bytes":134119424,"before_bytes":3088285696,"chunks_compressed":1},"met.forcing_station_timeseries":{"after_bytes":null,"before_bytes":0,"chunks_compressed":0}},"per_tick_bound":1,"schema_version":"2.0","selected":[{"after_bytes":134119424,"before_bytes":3088285696,"chunk_name":"_hyper_3_7_chunk","chunk_schema":"_timescaledb_internal","hypertable_name":"river_timeseries","hypertable_schema":"hydro","range_end":"2026-06-04T00:00:00Z","range_start":"2026-05-28T00:00:00Z"}],"skipped":[{"after_bytes":null,"before_bytes":0,"chunk_name":"_hyper_3_10_chunk","chunk_schema":"_timescaledb_internal","hypertable_name":"river_timeseries","hypertable_schema":"hydro","range_end":"2026-07-09T00:00:00Z","range_start":"2026-07-02T00:00:00Z","skip_reason":"range_end inside lag window"},{"after_bytes":null,"before_bytes":0,"chunk_name":"_hyper_3_14_chunk","chunk_schema":"_timescaledb_internal","hypertable_name":"river_timeseries","hypertable_schema":"hydro","range_end":"2026-07-16T00:00:00Z","range_start":"2026-07-09T00:00:00Z","skip_reason":"range_end inside lag window"},{"after_bytes":null,"before_bytes":0,"chunk_name":"_hyper_1_12_chunk","chunk_schema":"_timescaledb_internal","hypertable_name":"forcing_station_timeseries","hypertable_schema":"met","range_end":"2026-07-09T00:00:00Z","range_start":"2026-07-02T00:00:00Z","skip_reason":"range_end inside lag window"},{"after_bytes":null,"before_bytes":0,"chunk_name":"_hyper_1_13_chunk","chunk_schema":"_timescaledb_internal","hypertable_name":"forcing_station_timeseries","hypertable_schema":"met","range_end":"2026-07-16T00:00:00Z","range_start":"2026-07-09T00:00:00Z","skip_reason":"range_end inside lag window"}]}
