{"budget":{"cleanup_margin_seconds":300,"compress_timeout_ms":3600000,"systemd_wall_seconds":3941,"wrapper_wall_seconds":3900},"deferred":[{"after_bytes":null,"before_bytes":0,"chunk_name":"_hyper_9_155_chunk","chunk_schema":"_timescaledb_internal","defer_reason":"per-tick bound reached","hypertable_name":"river_timeseries","hypertable_schema":"hydro","range_end":"2026-09-02T00:00:00Z","range_start":"2026-09-01T00:00:00Z"},{"after_bytes":null,"before_bytes":0,"chunk_name":"_hyper_9_156_chunk","chunk_schema":"_timescaledb_internal","defer_reason":"per-tick bound reached","hypertable_name":"river_timeseries","hypertable_schema":"hydro","range_end":"2026-09-03T00:00:00Z","range_start":"2026-09-02T00:00:00Z"},{"after_bytes":null,"before_bytes":0,"chunk_name":"_hyper_9_157_chunk","chunk_schema":"_timescaledb_internal","defer_reason":"per-tick bound reached","hypertable_name":"river_timeseries","hypertable_schema":"hydro","range_end":"2026-09-04T00:00:00Z","range_start":"2026-09-03T00:00:00Z"},{"after_bytes":null,"before_bytes":0,"chunk_name":"_hyper_9_158_chunk","chunk_schema":"_timescaledb_internal","defer_reason":"per-tick bound reached","hypertable_name":"river_timeseries","hypertable_schema":"hydro","range_end":"2026-09-05T00:00:00Z","range_start":"2026-09-04T00:00:00Z"},{"after_bytes":null,"before_bytes":0,"chunk_name":"_hyper_9_159_chunk","chunk_schema":"_timescaledb_internal","defer_reason":"per-tick bound reached","hypertable_name":"river_timeseries","hypertable_schema":"hydro","range_end":"2026-09-06T00:00:00Z","range_start":"2026-09-05T00:00:00Z"},{"after_bytes":null,"before_bytes":0,"chunk_name":"_hyper_9_160_chunk","chunk_schema":"_timescaledb_internal","defer_reason":"per-tick bound reached","hypertable_name":"river_timeseries","hypertable_schema":"hydro","range_end":"2026-09-07T00:00:00Z","range_start":"2026-09-06T00:00:00Z"},{"after_bytes":null,"before_bytes":0,"chunk_name":"_hyper_9_161_chunk","chunk_schema":"_timescaledb_internal","defer_reason":"per-tick bound reached","hypertable_name":"river_timeseries","hypertable_schema":"hydro","range_end":"2026-09-08T00:00:00Z","range_start":"2026-09-07T00:00:00Z"},{"after_bytes":null,"before_bytes":0,"chunk_name":"_hyper_9_162_chunk","chunk_schema":"_timescaledb_internal","defer_reason":"per-tick bound reached","hypertable_name":"river_timeseries","hypertable_schema":"hydro","range_end":"2026-09-09T00:00:00Z","range_start":"2026-09-08T00:00:00Z"},{"after_bytes":null,"before_bytes":0,"chunk_name":"_hyper_9_163_chunk","chunk_schema":"_timescaledb_internal","defer_reason":"per-tick bound reached","hypertable_name":"river_timeseries","hypertable_schema":"hydro","range_end":"2026-09-10T00:00:00Z","range_start":"2026-09-09T00:00:00Z"},{"after_bytes":null,"before_bytes":0,"chunk_name":"_hyper_9_164_chunk","chunk_schema":"_timescaledb_internal","defer_reason":"per-tick bound reached","hypertable_name":"river_timeseries","hypertable_schema":"hydro","range_end":"2026-09-11T00:00:00Z","range_start":"2026-09-10T00:00:00Z"},{"after_bytes":null,"before_bytes":0,"chunk_name":"_hyper_9_165_chunk","chunk_schema":"_timescaledb_internal","defer_reason":"per-tick bound reached","hypertable_name":"river_timeseries","hypertable_schema":"hydro","range_end":"2026-09-12T00:00:00Z","range_start":"2026-09-11T00:00:00Z"},{"after_bytes":null,"before_bytes":0,"chunk_name":"_hyper_9_143_chunk","chunk_schema":"_timescaledb_internal","defer_reason":"per-tick bound reached","hypertable_name":"river_timeseries","hypertable_schema":"hydro","range_end":"2026-09-13T00:00:00Z","range_start":"2026-09-12T00:00:00Z"},{"after_bytes":null,"before_bytes":0,"chunk_name":"_hyper_9_141_chunk","chunk_schema":"_timescaledb_internal","defer_reason":"per-tick bound reached","hypertable_name":"river_timeseries","hypertable_schema":"hydro","range_end":"2026-09-14T00:00:00Z","range_start":"2026-09-13T00:00:00Z"},{"after_bytes":null,"before_bytes":0,"chunk_name":"_hyper_9_130_chunk","chunk_schema":"_timescaledb_internal","defer_reason":"per-tick bound reached","hypertable_name":"river_timeseries","hypertable_schema":"hydro","range_end":"2026-09-15T00:00:00Z","range_start":"2026-09-14T00:00:00Z"}],"generated_at":"2026-09-18T14:36:11.733825Z","head_sha":"9548148104a7980898d6dbf56e2e953359c4687a","lag_seconds":172800,"mode":"enforce","now_utc":"2026-09-17T12:00:00Z","outcome":"clean","per_table_totals":{"hydro.river_timeseries":{"after_bytes":11009802240,"before_bytes":41130123264,"chunks_compressed":2},"hydro.river_timeseries_legacy":{"after_bytes":null,"before_bytes":0,"chunks_compressed":0},"met.forcing_station_timeseries":{"after_bytes":null,"before_bytes":0,"chunks_compressed":0}},"per_tick_bound":2,"schema_version":"2.1","selected":[{"after_bytes":5405409280,"before_bytes":20160806912,"chunk_name":"_hyper_9_153_chunk","chunk_schema":"_timescaledb_internal","hypertable_name":"river_timeseries","hypertable_schema":"hydro","mutation_state":"committed","range_end":"2026-08-31T00:00:00Z","range_start":"2026-08-30T00:00:00Z"},{"after_bytes":5604392960,"before_bytes":20969316352,"chunk_name":"_hyper_9_154_chunk","chunk_schema":"_timescaledb_internal","hypertable_name":"river_timeseries","hypertable_schema":"hydro","mutation_state":"committed","range_end":"2026-09-01T00:00:00Z","range_start":"2026-08-31T00:00:00Z"}],"skipped":[{"after_bytes":null,"before_bytes":0,"chunk_name":"_hyper_9_131_chunk","chunk_schema":"_timescaledb_internal","hypertable_name":"river_timeseries","hypertable_schema":"hydro","range_end":"2026-09-16T00:00:00Z","range_start":"2026-09-15T00:00:00Z","skip_reason":"range_end inside lag window"},{"after_bytes":null,"before_bytes":0,"chunk_name":"_hyper_9_132_chunk","chunk_schema":"_timescaledb_internal","hypertable_name":"river_timeseries","hypertable_schema":"hydro","range_end":"2026-09-17T00:00:00Z","range_start":"2026-09-16T00:00:00Z","skip_reason":"range_end inside lag window"},{"after_bytes":null,"before_bytes":0,"chunk_name":"_hyper_9_133_chunk","chunk_schema":"_timescaledb_internal","hypertable_name":"river_timeseries","hypertable_schema":"hydro","range_end":"2026-09-18T00:00:00Z","range_start":"2026-09-17T00:00:00Z","skip_reason":"range_end inside lag window"},{"after_bytes":null,"before_bytes":0,"chunk_name":"_hyper_9_134_chunk","chunk_schema":"_timescaledb_internal","hypertable_name":"river_timeseries","hypertable_schema":"hydro","range_end":"2026-09-19T00:00:00Z","range_start":"2026-09-18T00:00:00Z","skip_reason":"range_end inside lag window"},{"after_bytes":null,"before_bytes":0,"chunk_name":"_hyper_9_135_chunk","chunk_schema":"_timescaledb_internal","hypertable_name":"river_timeseries","hypertable_schema":"hydro","range_end":"2026-09-20T00:00:00Z","range_start":"2026-09-19T00:00:00Z","skip_reason":"range_end inside lag window"},{"after_bytes":null,"before_bytes":0,"chunk_name":"_hyper_9_136_chunk","chunk_schema":"_timescaledb_internal","hypertable_name":"river_timeseries","hypertable_schema":"hydro","range_end":"2026-09-21T00:00:00Z","range_start":"2026-09-20T00:00:00Z","skip_reason":"range_end inside lag window"},{"after_bytes":null,"before_bytes":0,"chunk_name":"_hyper_9_142_chunk","chunk_schema":"_timescaledb_internal","hypertable_name":"river_timeseries","hypertable_schema":"hydro","range_end":"2026-09-22T00:00:00Z","range_start":"2026-09-21T00:00:00Z","skip_reason":"range_end inside lag window"},{"after_bytes":null,"before_bytes":0,"chunk_name":"_hyper_9_170_chunk","chunk_schema":"_timescaledb_internal","hypertable_name":"river_timeseries","hypertable_schema":"hydro","range_end":"2026-09-23T00:00:00Z","range_start":"2026-09-22T00:00:00Z","skip_reason":"range_end inside lag window"},{"after_bytes":null,"before_bytes":0,"chunk_name":"_hyper_9_175_chunk","chunk_schema":"_timescaledb_internal","hypertable_name":"river_timeseries","hypertable_schema":"hydro","range_end":"2026-09-24T00:00:00Z","range_start":"2026-09-23T00:00:00Z","skip_reason":"range_end inside lag window"},{"after_bytes":null,"before_bytes":0,"chunk_name":"_hyper_9_181_chunk","chunk_schema":"_timescaledb_internal","hypertable_name":"river_timeseries","hypertable_schema":"hydro","range_end":"2026-09-25T00:00:00Z","range_start":"2026-09-24T00:00:00Z","skip_reason":"range_end inside lag window"},{"after_bytes":null,"before_bytes":0,"chunk_name":"_hyper_3_110_chunk","chunk_schema":"_timescaledb_internal","hypertable_name":"river_timeseries_legacy","hypertable_schema":"hydro","range_end":"2026-09-17T00:00:00Z","range_start":"2026-09-10T00:00:00Z","skip_reason":"range_end inside lag window"},{"after_bytes":null,"before_bytes":0,"chunk_name":"_hyper_3_113_chunk","chunk_schema":"_timescaledb_internal","hypertable_name":"river_timeseries_legacy","hypertable_schema":"hydro","range_end":"2026-09-24T00:00:00Z","range_start":"2026-09-17T00:00:00Z","skip_reason":"range_end inside lag window"},{"after_bytes":null,"before_bytes":0,"chunk_name":"_hyper_1_109_chunk","chunk_schema":"_timescaledb_internal","hypertable_name":"forcing_station_timeseries","hypertable_schema":"met","range_end":"2026-09-17T00:00:00Z","range_start":"2026-09-10T00:00:00Z","skip_reason":"range_end inside lag window"},{"after_bytes":null,"before_bytes":0,"chunk_name":"_hyper_1_112_chunk","chunk_schema":"_timescaledb_internal","hypertable_name":"forcing_station_timeseries","hypertable_schema":"met","range_end":"2026-09-24T00:00:00Z","range_start":"2026-09-17T00:00:00Z","skip_reason":"range_end inside lag window"},{"after_bytes":null,"before_bytes":0,"chunk_name":"_hyper_1_176_chunk","chunk_schema":"_timescaledb_internal","hypertable_name":"forcing_station_timeseries","hypertable_schema":"met","range_end":"2026-09-25T00:00:00Z","range_start":"2026-09-24T00:00:00Z","skip_reason":"range_end inside lag window"}]}
